{"DefinitionHash":"aaaaaaaaaaaaaaaaaaaaaaaaaaaaaaaaaaaaaaaaaaaaaaaaaaaaaaaaaaaaaaaa","FileCount":0,"GeneratedAtUtc":"2026-09-08T00:00:00.0000000Z","LockHash":"bbbbbbbbbbbbbbbbbbbbbbbbbbbbbbbbbbbbbbbbbbbbbbbbbbbbbbbbbbbbbbbb","ManifestHashes":{"Claude":"dddddddddddddddddddddddddddddddddddddddddddddddddddddddddddddddd","Codex":"eeeeeeeeeeeeeeeeeeeeeeeeeeeeeeeeeeeeeeeeeeeeeeeeeeeeeeeeeeeeeeee","Reasonix":"ffffffffffffffffffffffffffffffffffffffffffffffffffffffffffffffff"},"MaterializationHash":"92a493cfe43fc655e4f42f7ff734a5a71000c18ae286f7f71198739f7cb3a95b","MaterializedRoots":{"Claude":{"Exists":true,"FileCount":0,"RelativePath":"claude/skills","TreeHash":"1111111111111111111111111111111111111111111111111111111111111111"},"Codex":{"Exists":true,"FileCount":0,"RelativePath":"codex/skills","TreeHash":"2222222222222222222222222222222222222222222222222222222222222222"},"Reasonix":{"Exists":true,"FileCount":0,"RelativePath":"reasonix/skills","TreeHash":"3333333333333333333333333333333333333333333333333333333333333333"}},"Name":"full","RepositoryCommit":"cccccccccccccccccccccccccccccccccccccccc","Result":"PASS","SchemaVersion":3,"SkillSourceEvidence":"available","SkillSourceHashes":{"Claude":{},"Codex":{},"Reasonix":{}},"StagedSkillTreeHashes":{"Claude":{},"Codex":{},"Reasonix":{}},"TaskOverlayHash":null,"TaskOverlaySkills":{"Claude":[],"Codex":[],"Reasonix":[]}}
